{"standardVersion":"1-draft","kind":"instrument","id":"instrument:hybrid","metadata":{"name":"Hybrid Layer","description":"Two Layers using two different Source Providers.","authors":[{"name":"Lodestar Example Authors"}],"tags":["hybrid","layered"]},"layers":[{"id":"layer:synth","source":{"id":"source:synth","providerId":"org.example.source.synth","payloadVersion":"1","payload":{"waveform":"pulse"}},"channel":{"id":"channel:synth","gain":0.8,"pan":-0.15,"output":"mixer:instrument"}},{"id":"layer:sample","source":{"id":"source:sample","providerId":"org.example.source.sample","payloadVersion":"1","resourceIds":["resource:texture"],"payload":{"rootNote":60}},"channel":{"id":"channel:sample","gain":0.7,"pan":0.15,"output":"mixer:instrument"}}],"instrumentChannel":{"id":"channel:instrument","gain":1,"pan":0,"output":"mixer:instrument-output"},"mixer":{"scope":"instrument","buses":[]}}
