{"standardVersion":"1-draft","kind":"instrument","id":"instrument:three-layer-group","metadata":{"name":"Three-Layer Group","description":"Two Layers grouped through a submix and one routed directly.","authors":[{"name":"Lodestar Example Authors"}],"tags":["layered","submix"]},"layers":[{"id":"layer:a","source":{"id":"source:a","providerId":"org.example.source.synth","payloadVersion":"1","payload":{"waveform":"saw"}},"channel":{"id":"channel:a","gain":1,"pan":-0.2,"sends":[],"output":"bus:body"}},{"id":"layer:b","source":{"id":"source:b","providerId":"org.example.source.synth","payloadVersion":"1","payload":{"waveform":"square"}},"channel":{"id":"channel:b","gain":1,"pan":0.2,"sends":[],"output":"bus:body"}},{"id":"layer:c","source":{"id":"source:c","providerId":"org.example.source.sample","payloadVersion":"1","payload":{"resourceId":"resource:attack"}},"channel":{"id":"channel:c","gain":1,"pan":0,"sends":[],"output":"mixer:instrument"}}],"instrumentChannel":{"id":"channel:instrument","gain":1,"pan":0,"inserts":[],"sends":[],"output":"mixer:instrument-output"},"mixer":{"scope":"instrument","buses":[{"id":"bus:body","kind":"submix","channel":{"id":"channel:body","gain":1,"pan":0,"inserts":[{"id":"insert:glue","effectId":"effect:compressor"}],"sends":[],"output":"mixer:instrument"}}]}}
