{"standardVersion":"1-draft","kind":"instrument","id":"org.example.factory:instrument:minimal-synth","metadata":{"name":"Minimal Synth","description":"A single-layer generic synthesis Instrument.","authors":[{"name":"Lodestar Example Authors"}],"tags":["synth","lead"]},"layers":[{"id":"layer:main","source":{"id":"source:main","providerId":"org.example.source.synth","payloadVersion":"1","payload":{"algorithm":"subtractive","waveform":"saw"}},"channel":{"id":"channel:layer-main","gain":1,"pan":0,"inserts":[],"sends":[],"output":"mixer:instrument"}}],"instrumentChannel":{"id":"channel:instrument","gain":1,"pan":0,"inserts":[],"sends":[],"output":"mixer:instrument-output"},"mixer":{"scope":"instrument","buses":[]}}
